{"schemaVersion":1,"id":"solarized","label":"极光配色","version":"1.0.0","description":"经典暖纸底与青金强调色的低疲劳主题。","targets":["social"],"status":"published","source":"builtin","basedOn":null,"tags":["solarized","warm","calm"],"tokens":{"colors":{"background":"#EEE8D5","surface":"#FFFAF0","page":"#FDF6E3","text":"#073642","muted":"#657B83","accent":"#2AA198","accentSecondary":"#B58900","line":"#93A1A1","inverseText":"#FFFFFF","codeBackground":"#002B36"},"typography":{"family":"sans","headingFamily":"sans","bodyPx":11,"h1Px":34,"h2Px":12,"captionPx":9,"lineHeight":1.45,"letterSpacingEm":0},"spacing":{"articlePaddingPx":18,"sectionPx":24,"paragraphPx":12,"cardGapPx":12},"shape":{"radiusPx":14,"borderWidthPx":1,"shadow":"soft"}},"social":{"recipes":{"surface":"palette","frame":"palette-frame","decoration":"orbit","eyebrow":"accent","coverTitle":"editorial","skeleton":"editorial-split","coverSupport":"statement","ending":"accent-fill","list":"tinted-card","code":"dark-panel"},"effects":{"texture":"none","decorationOpacity":0.35,"contentTiltDeg":0}}}
