{"schemaVersion":1,"id":"paper-craft","label":"纸艺暖调","version":"1.0.0","description":"纸张、印刷边线和轻微错位感。","targets":["social"],"status":"published","source":"builtin","basedOn":null,"tags":["paper","warm","editorial"],"tokens":{"colors":{"background":"#D8CBB3","surface":"#FFFAF0","page":"#F5EAD6","text":"#3A2820","muted":"#80685A","accent":"#C0392B","accentSecondary":"#D9A441","line":"#B79B7E","inverseText":"#FFFFFF","codeBackground":"#362721"},"typography":{"family":"sans","headingFamily":"serif","bodyPx":11,"h1Px":32,"h2Px":13,"captionPx":9,"lineHeight":1.45,"letterSpacingEm":0},"spacing":{"articlePaddingPx":18,"sectionPx":24,"paragraphPx":12,"cardGapPx":12},"shape":{"radiusPx":2,"borderWidthPx":1,"shadow":"hard"}},"social":{"recipes":{"surface":"palette","frame":"palette-frame","decoration":"paper-offset","eyebrow":"stamp","coverTitle":"editorial","skeleton":"paper-offset","coverSupport":"lead","ending":"accent-fill","list":"tinted-card","code":"dark-panel"},"effects":{"texture":"paper-grain","decorationOpacity":0.22,"contentTiltDeg":-0.35}}}
