{"schemaVersion":1,"id":"orange","label":"落日橙界","version":"1.0.0","description":"高能橙色、深棕背景与硬阴影主题。","targets":["social"],"status":"published","source":"builtin","basedOn":null,"tags":["orange","dark","bold","事件图文","快讯"],"tokens":{"colors":{"background":"#1A1200","surface":"#302009","page":"#251700","text":"#FFF5E6","muted":"#D4A85E","accent":"#FF7A00","accentSecondary":"#FFD166","line":"#704212","inverseText":"#0F0A00","codeBackground":"#0F0A00"},"typography":{"family":"sans","headingFamily":"sans","bodyPx":11,"h1Px":34,"h2Px":12,"captionPx":9,"lineHeight":1.45,"letterSpacingEm":-0.05},"spacing":{"articlePaddingPx":18,"sectionPx":24,"paragraphPx":12,"cardGapPx":12},"shape":{"radiusPx":10,"borderWidthPx":1,"shadow":"hard"}},"social":{"recipes":{"surface":"palette","frame":"palette-frame","decoration":"orbit","eyebrow":"stamp","coverTitle":"poster","skeleton":"impact-band","coverSupport":"statement","ending":"accent-fill","list":"tinted-card","code":"dark-panel"},"effects":{"texture":"none","decorationOpacity":0.35,"contentTiltDeg":0}}}
