{"schemaVersion":1,"id":"research-report","label":"财经印刷","version":"1.0.0","description":"双线刊头与严谨表格构成的财经研报排版。","targets":["article"],"status":"published","source":"builtin","basedOn":null,"tags":["research","finance","formal"],"tokens":{"colors":{"background":"#FFFFFF","surface":"#F3F6F9","text":"#1A1A1A","muted":"#6B7280","accent":"#0F2B4C","accentSecondary":"#52687F","line":"#B8C0C9","inverseText":"#FFFFFF","codeBackground":"#F2F4F6"},"typography":{"family":"sans","headingFamily":"serif","bodyPx":16,"h1Px":32,"h2Px":22,"captionPx":13,"lineHeight":1.8,"letterSpacingEm":0.025},"spacing":{"articlePaddingPx":20,"sectionPx":30,"paragraphPx":16,"cardGapPx":12},"shape":{"radiusPx":0,"borderWidthPx":1,"shadow":"none"}},"article":{"recipes":{"frame":"report-frame","rhythm":"standard","kicker":"center-label","h1":"center-double","h2":"center-double","lead":"rule-bottom","quote":"boxed","divider":"rule-mark","list":"default","table":"ink-header","image":"framed"},"behavior":{"justify":true,"highlightStrong":"ink","numberSections":false}}}
