{"schemaVersion":1,"id":"magazine-warm","label":"暖纸杂志风","version":"1.0.0","description":"米白纸张与棕褐刊物语气，适合观点和深度内容。","targets":["article"],"status":"published","source":"builtin","basedOn":null,"tags":["warm","editorial","serif"],"tokens":{"colors":{"background":"#F5EFE3","surface":"#FFF9EF","text":"#30261F","muted":"#786F66","accent":"#76533B","accentSecondary":"#C99A6B","line":"#D8CDBF","inverseText":"#FFFFFF","codeBackground":"#241D18"},"typography":{"family":"sans","headingFamily":"serif","bodyPx":16,"h1Px":30,"h2Px":22,"captionPx":13,"lineHeight":1.8,"letterSpacingEm":0.025},"spacing":{"articlePaddingPx":18,"sectionPx":30,"paragraphPx":16,"cardGapPx":12},"shape":{"radiusPx":10,"borderWidthPx":1,"shadow":"none"}},"article":{"recipes":{"frame":"warm-frame","rhythm":"airy","kicker":"chip","h1":"editorial-serif","h2":"numbered-rule","lead":"rule-bottom","quote":"warm-card","divider":"ornament","list":"default","table":"tinted-header","image":"plain"},"behavior":{"justify":true,"highlightStrong":"accent","numberSections":true}}}
