{"schemaVersion":1,"id":"tokyo-night","label":"东京之夜","version":"1.0.0","description":"蓝紫霓虹点亮深夜界面的开发者主题。","targets":["social"],"status":"published","source":"builtin","basedOn":null,"tags":["dark","blue","purple"],"tokens":{"colors":{"background":"#16161E","surface":"#24283B","page":"#1A1B26","text":"#C0CAF5","muted":"#9AA5CE","accent":"#7AA2F7","accentSecondary":"#BB9AF7","line":"#414868","inverseText":"#FFFFFF","codeBackground":"#101014"},"typography":{"family":"sans","headingFamily":"sans","bodyPx":11,"h1Px":34,"h2Px":12,"captionPx":9,"lineHeight":1.45,"letterSpacingEm":0},"spacing":{"articlePaddingPx":18,"sectionPx":24,"paragraphPx":12,"cardGapPx":12},"shape":{"radiusPx":18,"borderWidthPx":1,"shadow":"soft"}},"social":{"recipes":{"surface":"palette","frame":"palette-frame","decoration":"orbit","eyebrow":"stamp","coverTitle":"highlight-block","skeleton":"terminal-rail","coverSupport":"statement","ending":"accent-fill","list":"tinted-card","code":"dark-panel"},"effects":{"texture":"none","decorationOpacity":0.35,"contentTiltDeg":0}}}
