{
  "schemaVersion": 1,
  "id": "brutalist",
  "label": "野兽派",
  "version": "1.0.0",
  "description": "粗黑边框、硬阴影和原色块构成的野兽派主题。",
  "targets": ["social"],
  "status": "published",
  "source": "builtin",
  "basedOn": null,
  "tags": ["brutalist", "hard", "editorial", "深度观点", "事件图文"],
  "tokens": {
    "colors": {
      "background": "#D8D2BF", "surface": "#FFF9DF", "page": "#F4EDCE", "text": "#111111", "muted": "#3E392E",
      "accent": "#F04B32", "accentSecondary": "#F2C94C", "line": "#111111", "inverseText": "#FFFFFF", "codeBackground": "#111111"
    },
    "typography": {"family": "serif", "headingFamily": "serif", "bodyPx": 11, "h1Px": 34, "h2Px": 12, "captionPx": 9, "codePx": 11, "lineHeight": 1.45, "letterSpacingEm": 0},
    "spacing": {"articlePaddingPx": 18, "sectionPx": 24, "paragraphPx": 12, "cardGapPx": 12},
    "shape": {"radiusPx": 0, "borderWidthPx": 4, "shadow": "hard"}
  },
  "social": {
    "templatePack": {"id": "brutalist-v1", "version": 1},
    "recipes": {"surface": "brutalist", "frame": "brutalist-frame", "decoration": "orbit", "eyebrow": "stamp", "coverTitle": "poster", "skeleton": "impact-band", "coverSupport": "statement", "ending": "hard-fill", "list": "hard-card", "code": "hard-panel"},
    "effects": {"texture": "none", "decorationOpacity": 1, "contentTiltDeg": 0},
    "components": {"eyebrow": {"fontFamily": "inherit", "fontWeight": 800, "colorRole": "text"}}
  }
}
