{"schemaVersion":1,"id":"neon","label":"霓虹终端","version":"1.0.0","description":"高亮绿与洋红构成的网格终端主题。","targets":["social"],"status":"published","source":"builtin","basedOn":null,"tags":["neon","terminal","dark","技术教程","数据对比"],"tokens":{"colors":{"background":"#050809","surface":"#0C1C17","page":"#07100E","text":"#EAFFF7","muted":"#9BD8C2","accent":"#55FFB6","accentSecondary":"#FF4FD8","line":"#1E5C44","inverseText":"#04100C","codeBackground":"#020403"},"typography":{"family":"mono","headingFamily":"mono","bodyPx":11,"h1Px":34,"h2Px":12,"captionPx":10,"codePx":11,"lineHeight":1.45,"letterSpacingEm":0},"spacing":{"articlePaddingPx":18,"sectionPx":24,"paragraphPx":12,"cardGapPx":12},"shape":{"radiusPx":3,"borderWidthPx":1,"shadow":"glow"}},"social":{"templatePack":{"id":"neon-v1","version":1},"recipes":{"surface":"neon","frame":"neon-frame","decoration":"orbit","eyebrow":"accent","coverTitle":"highlight-block","skeleton":"terminal-rail","coverSupport":"metric","ending":"accent-fill","list":"outlined-card","code":"terminal-panel"},"effects":{"texture":"grid","decorationOpacity":0.28,"contentTiltDeg":0}}}
