{"schemaVersion":1,"id":"news-digest","label":"黑白快讯","version":"1.0.0","description":"黑白高对比与红色重点构成的快讯版式。","targets":["article"],"status":"published","source":"builtin","basedOn":null,"tags":["news","contrast","fast","快讯"],"tokens":{"colors":{"background":"#FFFFFF","surface":"#F7F7F7","text":"#111111","muted":"#666666","accent":"#D61F26","accentSecondary":"#8F1419","line":"#BDBDBD","inverseText":"#FFFFFF","codeBackground":"#111111"},"typography":{"family":"hei","headingFamily":"hei","bodyPx":16,"h1Px":31,"h2Px":21,"captionPx":13,"lineHeight":1.8,"letterSpacingEm":0.025},"spacing":{"articlePaddingPx":18,"sectionPx":30,"paragraphPx":16,"cardGapPx":12},"shape":{"radiusPx":0,"borderWidthPx":1,"shadow":"none"}},"article":{"recipes":{"frame":"news-frame","rhythm":"dense","kicker":"chip","h1":"invert-block","h2":"invert-tag","lead":"none","quote":"plain-bar","divider":"thick-bar","list":"news-panel","table":"ink-header","image":"plain"},"behavior":{"justify":true,"highlightStrong":"accent","numberSections":false}}}
