{"schemaVersion":1,"id":"charcoal","label":"极简炭黑","version":"1.0.0","description":"克制无圆角的黑灰单色主题。","targets":["social"],"status":"published","source":"builtin","basedOn":null,"tags":["black","minimal","mono"],"tokens":{"colors":{"background":"#0F0F0F","surface":"#242424","page":"#1A1A1A","text":"#EDEDED","muted":"#999999","accent":"#F5F5F5","accentSecondary":"#777777","line":"#454545","inverseText":"#111111","codeBackground":"#090909"},"typography":{"family":"sans","headingFamily":"sans","bodyPx":11,"h1Px":34,"h2Px":12,"captionPx":9,"lineHeight":1.45,"letterSpacingEm":0},"spacing":{"articlePaddingPx":18,"sectionPx":24,"paragraphPx":12,"cardGapPx":12},"shape":{"radiusPx":0,"borderWidthPx":1,"shadow":"none"}},"social":{"recipes":{"surface":"palette","frame":"palette-frame","decoration":"circle","eyebrow":"plain","coverTitle":"classic","skeleton":"impact-band","coverSupport":"statement","ending":"accent-fill","list":"outlined-card","code":"dark-panel"},"effects":{"texture":"none","decorationOpacity":0.35,"contentTiltDeg":0}}}
