{"schemaVersion":1,"id":"mocha","label":"摩卡原木","version":"1.0.1","description":"咖啡棕和原木纸色构成的沉静主题。","targets":["social"],"status":"published","source":"builtin","basedOn":null,"tags":["mocha","wood","warm","深度观点"],"tokens":{"colors":{"background":"#E8DCCF","surface":"#FFFAF4","page":"#FAF6F1","text":"#3D2B22","muted":"#7A5240","accent":"#8B5C3F","accentSecondary":"#C99A6B","line":"#CBB29D","inverseText":"#FFFFFF","codeBackground":"#30211B"},"typography":{"family":"sans","headingFamily":"serif","bodyPx":11,"h1Px":34,"h2Px":12,"captionPx":9,"codePx":11,"lineHeight":1.45,"letterSpacingEm":0},"spacing":{"articlePaddingPx":18,"sectionPx":24,"paragraphPx":12,"cardGapPx":12},"shape":{"radiusPx":16,"borderWidthPx":1,"shadow":"soft"}},"social":{"recipes":{"surface":"palette","frame":"palette-frame","decoration":"orbit","eyebrow":"accent","coverTitle":"editorial","skeleton":"stacked","coverSupport":"lead","ending":"accent-fill","list":"tinted-card","code":"dark-panel"},"effects":{"texture":"none","decorationOpacity":0.35,"contentTiltDeg":0},"components":{"eyebrow":{"fontFamily":"inherit","fontWeight":800,"colorRole":"muted"}}}}