{"schemaVersion":1,"id":"career-essay","label":"书信手账","version":"1.0.0","description":"米色纸张、衬线正文与书信式章节节奏。","targets":["article"],"status":"published","source":"builtin","basedOn":null,"tags":["career","letter","serif","深度观点"],"tokens":{"colors":{"background":"#F6EFDF","surface":"#FFF8E8","text":"#3B3226","muted":"#8A7B63","accent":"#A35D2F","accentSecondary":"#C89664","line":"#D8C7A9","inverseText":"#FFFFFF","codeBackground":"#332A20"},"typography":{"family":"kai","headingFamily":"kai","bodyPx":16,"h1Px":34,"h2Px":24,"captionPx":13,"lineHeight":1.8,"letterSpacingEm":0.025},"spacing":{"articlePaddingPx":18,"sectionPx":30,"paragraphPx":16,"cardGapPx":12},"shape":{"radiusPx":8,"borderWidthPx":1,"shadow":"none"}},"article":{"recipes":{"frame":"letter-frame","rhythm":"airy","kicker":"center-label","h1":"serif-display","h2":"cn-number","lead":"rule-bottom","quote":"quote-marks","divider":"stars","list":"default","table":"tinted-header","image":"plain"},"behavior":{"justify":true,"highlightStrong":"accent","numberSections":true}}}
