{"schemaVersion":1,"id":"tech-wire","label":"暗色终端","version":"1.0.0","description":"面向技术动态的终端式深色排版。","targets":["article"],"status":"published","source":"builtin","basedOn":null,"tags":["tech","dark","mono"],"tokens":{"colors":{"background":"#0D1117","surface":"#161B22","text":"#E6EDF3","muted":"#8B949E","accent":"#39D353","accentSecondary":"#58A6FF","line":"#30363D","inverseText":"#0D1117","codeBackground":"#161B22"},"typography":{"family":"sans","headingFamily":"sans","bodyPx":16,"h1Px":30,"h2Px":22,"captionPx":13,"lineHeight":1.8,"letterSpacingEm":0.01},"spacing":{"articlePaddingPx":18,"sectionPx":30,"paragraphPx":16,"cardGapPx":12},"shape":{"radiusPx":6,"borderWidthPx":1,"shadow":"none"}},"article":{"recipes":{"frame":"terminal-frame","kicker":"mono-line","h1":"terminal-title","h2":"terminal","lead":"none","quote":"terminal-panel","divider":"mono-comment","list":"chevron","table":"dark-header","image":"plain"},"behavior":{"justify":false,"highlightStrong":"accent","numberSections":false}}}
