{"schemaVersion":1,"id":"cover-violet-night","label":"紫夜星轨","version":"1.0.0","description":"深紫夜幕配淡紫荧光，前沿科技的想象空间，适合 AI 与新技术话题。","targets":["cover"],"status":"published","source":"builtin","basedOn":null,"tags":["技术教程","快讯"],"tokens":{"colors":{"background":"#241843","surface":"#2E2054","page":"#241843","text":"#F1ECFF","muted":"#A79ACB","accent":"#B18CFF","accentSecondary":"#4EE1C1","line":"#403266","inverseText":"#241843","codeBackground":"#180F30"},"typography":{"family":"sans","headingFamily":"sans","bodyPx":12,"h1Px":34,"h2Px":14,"captionPx":10,"codePx":10,"lineHeight":1.4,"letterSpacingEm":0},"spacing":{"articlePaddingPx":24,"sectionPx":24,"paragraphPx":10,"cardGapPx":12},"shape":{"radiusPx":4,"borderWidthPx":1,"shadow":"soft"}}}
