{"schemaVersion":1,"id":"ice-blue","label":"冰川冷调","version":"1.0.1","description":"清透蓝白渐层与柔和圆角构成的默认图文主题。","targets":["social"],"status":"published","source":"builtin","basedOn":null,"tags":["blue","clean","default","技术教程","数据对比"],"tokens":{"colors":{"background":"#DCE9F3","surface":"#F9FCFF","page":"#F9FCFF","text":"#102033","muted":"#476176","accent":"#1B6D98","accentSecondary":"#EC6B43","line":"#B9D4E4","inverseText":"#FFFFFF","codeBackground":"#102C3D"},"typography":{"family":"sans","headingFamily":"sans","bodyPx":11,"h1Px":34,"h2Px":12,"captionPx":9,"lineHeight":1.45,"letterSpacingEm":0},"spacing":{"articlePaddingPx":18,"sectionPx":24,"paragraphPx":12,"cardGapPx":12},"shape":{"radiusPx":22,"borderWidthPx":1,"shadow":"soft"}},"social":{"recipes":{"surface":"base","frame":"soft-orbit","decoration":"orbit","eyebrow":"accent","coverTitle":"classic","skeleton":"stacked","coverSupport":"lead","ending":"dark-fill","list":"soft-card","code":"dark-panel"},"effects":{"texture":"none","decorationOpacity":0.14,"contentTiltDeg":0},"components":{"eyebrow":{"fontFamily":"inherit","fontWeight":800,"colorRole":"muted"}}}}
