{"schemaVersion":1,"id":"cover-editorial-red","label":"砖红纪事","version":"1.0.0","description":"米白底配砖红色块，编号栏目的系列复盘感，对应效果图拼接箭头版式。","targets":["cover"],"status":"published","source":"builtin","basedOn":null,"tags":["深度观点","事件图文"],"tokens":{"colors":{"background":"#F6F4EF","surface":"#FFFFFF","page":"#F6F4EF","text":"#1A1A1A","muted":"#8A8578","accent":"#B3392E","accentSecondary":"#C9853F","line":"#DED8CA","inverseText":"#F6F4EF","codeBackground":"#2A2220"},"typography":{"family":"sans","headingFamily":"sans","bodyPx":12,"h1Px":34,"h2Px":14,"captionPx":10,"codePx":10,"lineHeight":1.4,"letterSpacingEm":0},"spacing":{"articlePaddingPx":24,"sectionPx":24,"paragraphPx":10,"cardGapPx":12},"shape":{"radiusPx":4,"borderWidthPx":1,"shadow":"soft"}}}
