{"schemaVersion":1,"id":"crimson","label":"赤焰硬核","version":"1.0.1","description":"赤红、暗黑与亮黄构成的高冲击硬核主题。","targets":["social"],"status":"published","source":"builtin","basedOn":null,"tags":["crimson","hard","dark","事件图文"],"tokens":{"colors":{"background":"#130408","surface":"#2D0B14","page":"#22070E","text":"#FFF1F4","muted":"#E29AAA","accent":"#FF2D55","accentSecondary":"#FFD60A","line":"#7E1D32","inverseText":"#FFFFFF","codeBackground":"#090103"},"typography":{"family":"sans","headingFamily":"sans","bodyPx":11,"h1Px":34,"h2Px":12,"captionPx":9,"lineHeight":1.45,"letterSpacingEm":-0.05},"spacing":{"articlePaddingPx":18,"sectionPx":24,"paragraphPx":12,"cardGapPx":12},"shape":{"radiusPx":4,"borderWidthPx":1,"shadow":"hard"}},"social":{"recipes":{"surface":"palette","frame":"palette-frame","decoration":"orbit","eyebrow":"accent","coverTitle":"poster","skeleton":"impact-band","coverSupport":"statement","ending":"accent-fill","list":"hard-accent","code":"accent-panel"},"effects":{"texture":"none","decorationOpacity":0.35,"contentTiltDeg":0}}}
