{"schemaVersion":1,"id":"bone-white","label":"月白清灰","version":"1.0.1","description":"近白灰阶、细线和零圆角构成的极简主题。","targets":["social"],"status":"published","source":"builtin","basedOn":null,"tags":["white","gray","minimal","深度观点","数据对比"],"tokens":{"colors":{"background":"#E7E7E5","surface":"#FFFFFF","page":"#F5F5F3","text":"#222222","muted":"#777777","accent":"#333333","accentSecondary":"#AAAAAA","line":"#C7C7C4","inverseText":"#FFFFFF","codeBackground":"#222222"},"typography":{"family":"sans","headingFamily":"serif","bodyPx":11,"h1Px":34,"h2Px":12,"captionPx":9,"lineHeight":1.45,"letterSpacingEm":0},"spacing":{"articlePaddingPx":18,"sectionPx":24,"paragraphPx":12,"cardGapPx":12},"shape":{"radiusPx":0,"borderWidthPx":1,"shadow":"soft"}},"social":{"recipes":{"surface":"palette","frame":"palette-frame","decoration":"circle","eyebrow":"underline","coverTitle":"editorial","skeleton":"editorial-split","coverSupport":"lead","ending":"accent-fill","list":"outlined-card","code":"dark-panel"},"effects":{"texture":"none","decorationOpacity":0.35,"contentTiltDeg":0},"components":{"eyebrow":{"fontFamily":"inherit","fontWeight":800,"colorRole":"muted"}}}}