{"schemaVersion":1,"id":"gossip-card","label":"卡片吃瓜风","version":"1.0.0","description":"橙红爆料语气与深色引述卡，适合轻松大厂话题。","targets":["article"],"status":"published","source":"builtin","basedOn":null,"tags":["gossip","card","orange","快讯","事件图文"],"tokens":{"colors":{"background":"#FFFFFF","surface":"#FFF1E8","text":"#1F2937","muted":"#4B5563","accent":"#FF6B35","accentSecondary":"#FFB067","line":"#E5E7EB","inverseText":"#FFFFFF","codeBackground":"#111111"},"typography":{"family":"sans","headingFamily":"sans","bodyPx":16,"h1Px":29,"h2Px":22,"captionPx":13,"lineHeight":1.8,"letterSpacingEm":0.025},"spacing":{"articlePaddingPx":18,"sectionPx":30,"paragraphPx":16,"cardGapPx":12},"shape":{"radiusPx":10,"borderWidthPx":1,"shadow":"soft"}},"article":{"recipes":{"frame":"gossip-frame","rhythm":"dense","kicker":"none","h1":"gossip-title","h2":"eyebrow-border","lead":"none","quote":"dark-block","divider":"hairline","list":"default","table":"tinted-header","image":"rounded"},"behavior":{"justify":false,"highlightStrong":"ink","numberSections":true}}}
