{"schemaVersion":1,"id":"cover-forest-cream","label":"墨绿米白","version":"1.0.0","description":"墨绿配米白的自然书卷气，适合人文向深度内容。","targets":["cover"],"status":"published","source":"builtin","basedOn":null,"tags":["深度观点"],"tokens":{"colors":{"background":"#F4F1E8","surface":"#FBF9F2","page":"#F4F1E8","text":"#1C2420","muted":"#82806F","accent":"#1E4D3B","accentSecondary":"#C9A227","line":"#D5CFC0","inverseText":"#F4F1E8","codeBackground":"#1C2420"},"typography":{"family":"sans","headingFamily":"serif","bodyPx":12,"h1Px":34,"h2Px":14,"captionPx":10,"codePx":10,"lineHeight":1.4,"letterSpacingEm":0},"spacing":{"articlePaddingPx":24,"sectionPx":24,"paragraphPx":10,"cardGapPx":12},"shape":{"radiusPx":4,"borderWidthPx":1,"shadow":"soft"}}}
