{"schemaVersion":1,"id":"peach","label":"雾桃白桃","version":"1.0.0","description":"柔和粉桃色、胶囊圆角和轻盈阴影主题。","targets":["social"],"status":"published","source":"builtin","basedOn":null,"tags":["peach","soft","friendly"],"tokens":{"colors":{"background":"#FFE8EE","surface":"#FFFafb","page":"#FFF5F7","text":"#5C3A4A","muted":"#A06B7D","accent":"#FF9AB8","accentSecondary":"#FFB86C","line":"#F2BFD0","inverseText":"#FFFFFF","codeBackground":"#5C3A4A"},"typography":{"family":"sans","headingFamily":"sans","bodyPx":11,"h1Px":34,"h2Px":12,"captionPx":9,"lineHeight":1.45,"letterSpacingEm":0},"spacing":{"articlePaddingPx":18,"sectionPx":24,"paragraphPx":12,"cardGapPx":12},"shape":{"radiusPx":26,"borderWidthPx":1,"shadow":"soft"}},"social":{"recipes":{"surface":"palette","frame":"palette-frame","decoration":"soft-blur","eyebrow":"underline","coverTitle":"classic","skeleton":"stacked","coverSupport":"lead","ending":"accent-fill","list":"tinted-card","code":"dark-panel"},"effects":{"texture":"none","decorationOpacity":0.35,"contentTiltDeg":0}}}
