{"schemaVersion":1,"id":"lavender","label":"芋泥暮色","version":"1.0.0","description":"低饱和紫色与柔软圆角构成的暮色主题。","targets":["social"],"status":"published","source":"builtin","basedOn":null,"tags":["lavender","soft","purple"],"tokens":{"colors":{"background":"#E9E0F6","surface":"#FCFAFF","page":"#F5F0FF","text":"#44385D","muted":"#81739A","accent":"#967BB6","accentSecondary":"#D49BB5","line":"#CFC1E3","inverseText":"#FFFFFF","codeBackground":"#302A43"},"typography":{"family":"sans","headingFamily":"sans","bodyPx":11,"h1Px":34,"h2Px":12,"captionPx":9,"lineHeight":1.45,"letterSpacingEm":0},"spacing":{"articlePaddingPx":18,"sectionPx":24,"paragraphPx":12,"cardGapPx":12},"shape":{"radiusPx":24,"borderWidthPx":1,"shadow":"soft"}},"social":{"recipes":{"surface":"palette","frame":"palette-frame","decoration":"soft-blur","eyebrow":"accent","coverTitle":"classic","skeleton":"stacked","coverSupport":"lead","ending":"accent-fill","list":"tinted-card","code":"dark-panel"},"effects":{"texture":"none","decorationOpacity":0.35,"contentTiltDeg":0}}}
