{"schemaVersion":1,"id":"retro-terminal","label":"复古终端","version":"1.0.0","description":"黑绿 CRT 扫描线与硬边框的复古终端主题。","targets":["social"],"status":"published","source":"builtin","basedOn":null,"tags":["terminal","retro","green"],"tokens":{"colors":{"background":"#020502","surface":"#071507","page":"#061006","text":"#7DFF8F","muted":"#38B84B","accent":"#00FF41","accentSecondary":"#B6FF00","line":"#167629","inverseText":"#000000","codeBackground":"#000000"},"typography":{"family":"mono","headingFamily":"mono","bodyPx":11,"h1Px":34,"h2Px":12,"captionPx":9,"lineHeight":1.45,"letterSpacingEm":0},"spacing":{"articlePaddingPx":18,"sectionPx":24,"paragraphPx":12,"cardGapPx":12},"shape":{"radiusPx":0,"borderWidthPx":1,"shadow":"glow"}},"social":{"recipes":{"surface":"palette","frame":"palette-frame","decoration":"scanlines","eyebrow":"accent","coverTitle":"highlight-block","ending":"accent-fill","list":"outlined-card","code":"terminal-panel"},"effects":{"texture":"scanlines","decorationOpacity":0.35,"contentTiltDeg":0}}}
